{
  "api_version": "task.aios.fuinno.cn/v0.1alpha1",
  "kind": "CapabilityDevelopment",
  "metadata": {
    "task_id": "develop-fictional-fastener-summary",
    "generation": 1,
    "created_at": "2026-09-03T00:00:00Z"
  },
  "spec": {
    "objective": "把虚构紧固件批次输入汇总为一个脱敏的标准 AIOS Capability Pack。",
    "non_goals": [
      "不连接任何客户环境。",
      "不签名、发布或分配能力。"
    ],
    "impact": "pack-only",
    "target": {
      "environment": "development",
      "repository": "https://github.com/santaalex/aios-capability-starter"
    },
    "capability": {
      "capability_id": "fictional-fastener-summary",
      "version": "0.1.0",
      "display_name": "虚构紧固件批次汇总",
      "source_manifest": "examples/fictional-demo/capability.source.json",
      "adapter_required": false,
      "known_limitations": [
        "示例只处理仓库内虚构 JSON，不代表真实工程算法。"
      ]
    },
    "artifacts": [],
    "human_actions": [],
    "acceptance": {
      "required_checks": [
        "task-contract",
        "pack-build",
        "pack-verify",
        "fictional-minimal-golden"
      ],
      "deliverables": [
        "fictional-fastener-summary-0.1.0.zip",
        "develop-fictional-fastener-summary.result.json"
      ],
      "forbidden_changes": [
        "customer-files",
        "control-plane",
        "customer-device"
      ]
    },
    "secrets_policy": {
      "bundle_must_not_contain": [
        "customer-files",
        "api-keys",
        "activation-codes",
        "device-credentials",
        "signing-keys"
      ]
    }
  }
}
