{
  "api_version": "task.aios.fuinno.cn/v0.1alpha1",
  "kind": "CapabilityDevelopment",
  "metadata": {
    "task_id": "develop-replace-me-capability",
    "generation": 1,
    "created_at": "2026-09-03T00:00:00Z"
  },
  "spec": {
    "objective": "Replace this text with one clear engineering outcome.",
    "non_goals": [
      "Do not sign, publish, or deploy the candidate."
    ],
    "impact": "pack-only",
    "target": {
      "environment": "development",
      "repository": "https://github.com/santaalex/aios-capability-starter"
    },
    "capability": {
      "capability_id": "replace-me-capability",
      "version": "0.1.0",
      "display_name": "替换为能力中文名称",
      "source_manifest": "capabilities/replace-me-capability/0.1.0/capability.source.json",
      "adapter_required": false,
      "known_limitations": [
        "Replace this item with a real limitation before delivery."
      ]
    },
    "artifacts": [],
    "human_actions": [],
    "acceptance": {
      "required_checks": [
        "task-contract",
        "pack-build",
        "pack-verify",
        "one-minimal-golden"
      ],
      "deliverables": [
        "capability-pack-zip",
        "task-result-json",
        "minimal-golden-report"
      ],
      "forbidden_changes": [
        "aios-platform-source",
        "control-plane",
        "customer-device"
      ]
    },
    "secrets_policy": {
      "bundle_must_not_contain": [
        "customer-files",
        "api-keys",
        "activation-codes",
        "device-credentials",
        "signing-keys"
      ]
    }
  }
}
